id,name,urlname,link,rating,created,description,organiserName,organiserMemberId,tags
8401402,PyLadies Boston,PyLadies-Boston,http://www.meetup.com/PyLadies-Boston/,4.81,1368029257000,"PyLadies Boston is for women and genderqueer individuals who are either Python
programmers or aspiring Python programmers in the Boston area. Or even if you
have no clue what Python is, but you're interested in learning to program.
It's a great language to learn if you have no prior programming experience.

Our goal is to get a larger number of women coding and involved in the open
source community. Developers and aspiring developers only, please. We
encourage all women to come out to our meetups. If anything is said during a
meetup or in any PyLadies Boston forum, please contact the organizers. We want
this to be a welcoming environment for all attendees and ask that everyone be
treated respectfully. We follow the [PyLadies Code of
Conduct](http://www.pyladies.com/CodeOfConduct/).

Join us on IRC! #pyladies-boston

**Pyladies Boston is for women and genderqueer individuals only. Men who join
will be removed from the group.** Nothing personal. If you're interested in
learning more about why we are women-only, read the articles in the ""Why Women
Only?"" section on our [resources page](http://boston.pyladies.com/resources/).

**Please note:** We highly discourage solicitation from recruiters unless
explicitly invited or are sponsoring an event. We are here to learn, to hack,
and support women in the Python developers' community. Job postings are
welcome on our forum.

What to expect at our meetups:

**Presentation nights (Monthly meetings)** : These will be presentations put
on by group members and other women (and the rare man) who are in Boston's
programming community. We welcome talks about any relevant subject... it does
not have to be strictly Python! We will not generally be installing things.
However, feel free to email the organizers (boston[at]pyladies[dot]com)
anytime if you are having trouble getting setup for a meeting. We also get
there about 30 minutes early as well and are happy to help before (or after!)
the meetup. The expected level of knowledge is just basic Python. Questions
are always welcome, but if it's really basic, we will ask you if we can answer
it later. If you can, also come grab a drink with us after the meetup!

**Beginner meetups** : Bring on your install problems! This is 100% about
making sure beginners are up and running. Our beginner meetups are weekly
(alternating Saturday and Sunday) and are project based. Don't have a project?
No problem! You can still come and we'll help you get started.

**Hack Days** : We like building things together! Open to suggestions as to
what we should build. We have coded our website during a hack day and have
plans to build Django apps in other hack days. In general, we'll spend at
least two hours trouble shooting installs, then the next four actually
building something cool! Also a good place to have install problems.

",Jennifer Konikowski,26418712.0,"['PyLadies Boston', 'women', 'individuals', 'Python', 'programmers', 'Python programmers', 'Boston area', 'learning', 'program', 'language', 'programming', 'experience', 'goal', 'coding', 'source', 'community', 'Developers', 'developers', 'meetups', 'meetup', 'PyLadies Boston forum', 'contact', 'organizers', 'environment', 'attendees', 'treated', 'PyLadies Code', 'Conduct](http://www.pyladies.com/CodeOfConduct/', 'IRC', 'Men', 'removed', 'group', 'personal', 'women-only', 'articles', 'Women', 'section', 'resources', 'page](http://boston.pyladies.com/resources/', 'solicitation', 'recruiters', 'invited', 'sponsoring', 'event', 'hack', 'Python developers', 'Job postings', 'forum', '**', 'Monthly', 'presentations', 'group members', 'rare', 'man', ""Boston's"", 'programming community', 'relevant', 'subject', 'installing things', 'email', 'boston[at]pyladies[dot]com', 'anytime', 'setup', 'meeting', 'minutes', 'early', 'happy', 'level', 'knowledge', 'Questions', 'grab', 'drink', 'beginners', 'running', 'beginner meetups', 'weekly', 'Saturday', 'Sunday', 'project', 'started', 'suggestions', 'website', 'hack day', 'plans', 'Django apps', 'hack days', 'shooting', 'cool', 'problems']"
422397,The Web Content Management Systems Meetup Group,newengland-webcms,http://www.meetup.com/newengland-webcms/,4.4,1170726764000,"Meet other CMS professionals, aficianados, and neophytes who want to learn
about current and best practices, state of the art, and current quality
practices for these CMS and related system used in business, government, and
academia for collaboration, website development, eCommerce, and simpler things
like family websites, web galleries, and other social networking applications.
Come to see demos, profiles, and assessments of the latest systems. Hear
independent evaluations of the most popular open source and commercial
offerings. Learn skills for using them, their bugs, strengths and weaknesses,
support available, and tons of other useful information. Learn how to select
and apply CMS products to your favorite applications. We began in 2007 and
have covered Joomla, Drupal, Plone, WordPress and their applications. So many
other systems that we simply have not had time or resources to cover them all.
If you are a user or developer and want to learn or present on your
experiences, please attend our meetings. Most of all, come to have fun,
network, make new friends, and learn from great people with a passion for
software!!

",James Thomas,13511544.0,"['CMS', 'professionals', 'aficianados', 'neophytes', 'current', 'practices', 'quality', 'system', 'business', 'government', 'academia', 'collaboration', 'website development', 'eCommerce', 'family websites', 'web galleries', 'social networking', 'demos', 'profiles', 'assessments', 'systems', 'independent', 'evaluations', 'commercial', 'offerings', 'Learn skills', 'bugs', 'strengths', 'weaknesses', 'tons', 'information', 'products', 'applications', 'Drupal', 'Plone', 'WordPress', 'time', 'resources', 'user', 'developer', 'learn', 'experiences', 'meetings', 'network', 'friends', 'people', 'passion']"
3642112,Avid Geo,avidgeo,http://www.meetup.com/avidgeo/,4.75,1334079874000,"This is a group for people who are interested in geo-spatial technologies.
This group is for users, developers, and the curious. There is also a monthly
mailing list if you are interested: http://eepurl.com/bw5E5

",Guido Stein,12227208.0,"['group', 'people', 'geo-spatial technologies', 'users', 'developers', 'monthly', 'mailing', 'http://eepurl.com/bw5E5']"
19722764,"IoT- Arduino, Beaglebone, Raspberry Pi 2",IoT-Arduino-Beaglebone-Raspberry-Pi-2,http://www.meetup.com/IoT-Arduino-Beaglebone-Raspberry-Pi-2/,0.0,1458240234000,"Who is interested in learning how to use Beaglebone, Arduino, Raspberry Pi 2.
If you are interested in learning about smart sensors, how to program for face
recognition, retina recognition, fingerprint sensor, this meetup would be for
you. We could use the tutorial and drive a bunch of sensors, LED's, and learn
together. Who is interested for April?

",Guru Virtues,197945021.0,"['interested', 'learning', 'Beaglebone', 'Arduino', 'Raspberry Pi 2', 'smart sensors', 'program', 'face', 'recognition', 'retina recognition', 'fingerprint sensor', 'meetup', 'tutorial', 'bunch of sensors', ""LED's""]"
19812877,Defect Prevention in C and C++,Defect-Prevention-in-C-and-C,http://www.meetup.com/Defect-Prevention-in-C-and-C/,0.0,1460051864000,"Ideal members are software programmers interested in saving time and money by
automating the peer review process and drastically reducing the cost and time
spent on functional testing.

Software programmers (C, C++, C#, Java) who want to write better software code
free of latent defects lurking in their software code that might cause
catastrophic failures and damage to their company reputation.  

Embedded software programmers

Software programmers interested in having coding standards.

Purpose - Learn, share and write better software code!

Typical activities will be in-person meetings and webinars to learn about
writing better, defect free software code

  

",Jeff,13751023.0,"['Ideal members', 'software programmers', 'saving', 'time', 'money', 'automating', 'peer review', 'reducing', 'cost', 'functional testing', 'Software programmers', 'Java', 'software code', 'latent', 'defects', 'catastrophic failures', 'damage', 'company reputation', 'Embedded software programmers', 'coding standards', 'Purpose', 'Learn', 'Typical', 'activities', 'in-person', 'meetings', 'webinars', 'defect free software code\n\n  \n\n']"
4268562,Boston Twisted Python,Boston-Twisted-Python,http://www.meetup.com/Boston-Twisted-Python/,5.0,1341864376000,"A meetup for Boston-area [Twisted Python](http://twistedmatrix.com)
developers. Most of our activities are Sprints, for fixing bugs and working on
new features for Twisted, but developers looking for help with their Twisted
projects are welcome as well, as are new people who are just getting started
(or just curious about Twisted in general.)

",David Sturgis,11364635.0,"['meetup', 'Boston-area', 'developers', 'activities', 'Sprints', 'bugs', 'working', 'features', 'Twisted', 'projects', 'people']"
18565891,Connected Car Boston,Boston-Connected-Car-Meetup,http://www.meetup.com/Boston-Connected-Car-Meetup/,5.0,1430151266000,"This group is all about the future of transportation and the connected car. If
you love cars (connected ones, autonomous ones, electric ones or even shared
ones) this is the group for you. We are a group of tech and car enthusiasts
who come together to share the biggest and brightest ideas and companies in
the space. We host monthly meetups with some of the most progressive startups,
entrepreneurs and companies in SF.

We hope you join us and look forward to meeting you all. If you're interested
in any aspect of the connected car, please join us. We'll give you a warm
welcome..

",Chris George,12088986.0,"['group', 'transportation', 'car', 'connected ones', 'autonomous ones', 'electric ones', 'tech', 'enthusiasts', 'companies', 'space', 'host', 'monthly', 'meetups', 'progressive', 'startups', 'entrepreneurs', 'SF', 'meeting', 'interested', 'connected', 'warm']"
19747348,Boston Redis,Boston-Redis,http://www.meetup.com/Boston-Redis/,0.0,1458722477000,"This group meets monthly to discuss different ways to use Redis to scale your
website

",Dave Nielsen,201204033.0,"['group', 'monthly', 'Redis', 'website']"
9925152,Cassandra Boston,The-Boston-Cassandra-Users,http://www.meetup.com/The-Boston-Cassandra-Users/,4.25,1377195663000,"Open to all those interested in Apache Cassandra, Big Data, Hadoop, Hive,
Hector, NoSQL, Pig, and high scalability. Let's get together and share what we
know!

Are you interested in speaking at an upcoming Cassandra event at any of our
groups? If so, sign up [here](http://bit.ly/2agsN07)!  

",DataStax,95402442.0,"['Open', 'interested', 'Apache Cassandra', 'Big Data', 'Hadoop', 'Hive', 'Hector', 'Pig', 'scalability', 'speaking', 'upcoming', 'Cassandra event', 'groups']"
10830372,Technology & Hiring,Mobile-SaaS-New-technology-West-of-Boston-hangout,http://www.meetup.com/Mobile-SaaS-New-technology-West-of-Boston-hangout/,5.0,1382649561000,"This is a group for anyone interested in discussing about Hiring in the new
Mobile , SaaS , Cloud , Big Data space .

Human Resource  , Staffing , Corp to Corp , Temp , Contracting  related
individuals who want to share leads or are looking for tech talent , this is
the meetup for you.

If you are a startup team looking to hire with shoestring budget , this is a
meetup for you.

",Hitesh Aurora,107882812.0,"['group', 'Hiring', 'Mobile', 'SaaS', 'Cloud', 'Big Data space', 'Human Resource  ', 'Staffing', 'Corp to Corp', 'Temp', 'Contracting  ', 'individuals', 'tech talent', 'meetup', 'team', 'hire', 'shoestring budget']"
18207269,Boston Marketing Technology Group,Boston-Marketing-Technology-Meetup,http://www.meetup.com/Boston-Marketing-Technology-Meetup/,4.67,1416671250000,"This is a group designed for those of us who bridge the marketing and
technology worlds. We are passionate about discussing new marketing trends and
methodologies, but as important, we want to learn HOW to actually execute on
and measure these approaches using technology. So, expect to get deep in the
weeds! If you are a marketer, a technologist, a data analytics expert or just
someone who wants to learn, we welcome you to join us!

Topics presented will include both products as well as underlying technology.
We may talk about general topics like predictive analytics, addressable TV,
marketing channel trends, but we will also discuss specific technologies, such
as Hadoop, Casandra, google analytics, social media API's and much more.

Beginners and veterans alike - we are all looking forward to both learning and
sharing what we know!  

",Rick Kollmeyer,13668981.0,"['group', 'bridge', 'marketing', 'technology', 'worlds', 'marketing trends', 'methodologies', 'measure', 'approaches', 'deep', 'weeds', 'marketer', 'technologist', 'data analytics', 'expert', 'Topics', 'products', 'predictive analytics', 'TV', 'marketing channel', 'trends', 'technologies', 'Hadoop', 'Casandra', 'google analytics', 'social media', ""API's"", 'Beginners', 'veterans', 'learning']"
13654582,LGBT Geek Out + Project Nites,LGBTGeeks,http://www.meetup.com/LGBTGeeks/,0.0,1396295094000,"This is a group for geeky, nerdy, and artsy-crafty people in the Boston area
who identify as LGBT to meet up and have fun times. Bring a creative project
to work on; attend a workshop with like-minded friends, discuss an engaging
book, movie, or comic; or just come to Vulcan-mind-mind with other fun and
interesting people. Let your geek flags fly and have an awesome time!

",Braden Darkwind,9399889.0,"['group', 'geeky', 'nerdy', 'artsy-crafty people', 'Boston area', 'LGBT', 'fun times', 'Bring', 'creative project', 'workshop', 'like-minded friends', 'engaging', 'book', 'movie', 'comic', 'Vulcan-mind-mind', 'people', 'awesome time']"
18225727,Cambridge Dataflow Analytics Meetup,Cambridge-Dataflow-Analytics-Meetup,http://www.meetup.com/Cambridge-Dataflow-Analytics-Meetup/,4.75,1417463794000,"We're a group of analysts, developers, IT pros, and hackers that are
interested in using dataflow-based technologies to solve big data problems and
automate business processes. Some of these technologies may include:
RapidMiner, Composable Analytics, Google Cloud DataFlow, Apache Spark,
Alteryx, and Lavastorm.

",Lars,133306462.0,"['group', 'analysts', 'developers', 'IT', 'pros', 'dataflow-based technologies', 'data problems', 'automate', 'business processes', 'technologies', 'RapidMiner', 'Composable Analytics', 'Google Cloud DataFlow', 'Apache Spark', 'Alteryx', 'Lavastorm']"
7832132,Code for Boston,Code-for-Boston,http://www.meetup.com/Code-for-Boston/,4.7,1364557939000,"Code for Boston is a Code for America Brigade - a volunteer civic innovation
organization created by Boston-area developers, designers, urban planners,
data geeks, and researchers with an interest in solving civic and social
problems through the use of creative technology.

We feel that Boston was the driving force in the creation of Government 1.0;
we should be leading the way for Gov 2.0. We seek to leverage the
revolutionary spirit of New England to help open, improve, and engage our
local governments across the Greater Boston area, and to pursue projects that
solve real problems in our communities.

In conjunction with our fellow Brigades across the country, we aim to provide
a focal point for community-based civic innovation and technology projects in
the Boston area. We meet weekly at the Cambridge Innovation Center in Kendall
Square, from 7 - 9:30pm. Please review our group's [Code of
Conduct](https://codeforboston.hackpad.com/Code-of-Conduct-Aq9NpCuTIZC) before
attending.  

> Homepage: [codeforboston.org](http://codeforboston.org)  
>
>
> Meeting notes:
> [codeforboston.hackpad.com](https://codeforboston.hackpad.com)
>
> GitHub: [codeforboston](https://github.com/codeforboston)  
>

",Code for America Brigade,189325617.0,"['Code for Boston', 'Code for America Brigade', 'volunteer civic', 'organization', 'Boston-area developers', 'designers', 'urban', 'planners', 'data geeks', 'researchers', 'civic', 'social', 'problems', 'creative technology', 'Boston', 'force', 'creation', 'Government', 'Gov 2.0', 'revolutionary spirit', 'New England', 'improve', 'local governments', 'Greater', 'Boston area', 'projects', 'real problems', 'communities', 'conjunction', 'fellow', 'Brigades', 'country', 'focal point', 'community-based civic innovation', 'technology', 'weekly', 'Cambridge Innovation Center', 'Kendall\nSquare', ""group's"", 'Conduct](https://codeforboston.hackpad.com/Code-of-Conduct-Aq9NpCuTIZC', 'attending', 'notes', 'GitHub']"
3332692,New England Digital Humanities,newenglanddigitalhumanities,http://www.meetup.com/newenglanddigitalhumanities/,4.26,1329781460000,"A community for anyone interested in the intersection of technology and the
humanities.

",Raoul,19282601.0,"['community', 'intersection', 'technology', 'humanities']"
20079189,Boston Cumulus Linux & Open Networking Meetup,Boston-Cumulus-Linux-Open-Networking-Meetup,http://www.meetup.com/Boston-Cumulus-Linux-Open-Networking-Meetup/,5.0,1466052706000,"Meet other developers and ops engineers using Cumulus Networks software and/or
open networking solutions. Meet new friends, share ideas, provide feedback,
become a champion and community leader. Talk about open networking and all of
the cool new ideas surrounding it.

Cumulus Networks simplifies data center operations by delivering operating
systems that run on industry standard Ethernet switches, merging networking
into the architectural and supply chain model of compute and leveraging
hundreds of existing management, automation and monitoring tools.

Learn more about Cumulus Networks software solutions at
<http://cumulusnetworks.com/products/>

Learn more about the Technology Ecosystem at
<http://cumulusnetworks.com/solutions/>

Join the Cumulus Networks Community at
<https://community.cumulusnetworks.com/cumulus>

",Cumulus Networks,209031624.0,"['developers', 'engineers', 'Cumulus Networks software', 'networking solutions', 'friends', 'feedback', 'champion', 'community leader', 'Talk', 'networking', 'Cumulus Networks', 'data center', 'operations', 'operating', 'systems', 'industry standard', 'Ethernet switches', 'architectural', 'supply chain model', 'management', 'automation', 'monitoring', 'Cumulus Networks software solutions', 'Technology', 'Ecosystem', 'http://cumulusnetworks.com/solutions/', 'Community']"
19298903,Waltham Data Science/Analytics Meetup Group,Waltham-Data-Science-Analytics,http://www.meetup.com/Waltham-Data-Science-Analytics/,4.5,1452215380000,"This is a call to all Data Science, Data Analytics, Machine Learning and Data
Visualization professionals in the Greater Waltham, metro-west area to come
together in Waltham to meet other like-minded individuals. There is a
tremendous amount of interest in this field amongst well established and
startups alike in this area which is richly underserved and this is a call for
those folks to come in and help create a vibrant community.

",Kishore Aradhya,94938222.0,"['Data Science', 'Data Analytics', 'Machine Learning', 'Data', 'Visualization', 'professionals', 'Greater Waltham', 'metro-west area', 'Waltham', 'like-minded', 'individuals', 'startups', 'area', 'community']"
19137113,Blue Hills Hackers,Blue-Hills-Hackers,http://www.meetup.com/Blue-Hills-Hackers/,0.0,1447953925000,"A group for science/engineer types living southwest of Boston to talk shop.  

  

[Slack Group ](https://bluehills-hackers.herokuapp.com/)  

  

",Matt Swan,187170402.0,"['group', 'science/engineer types', 'Boston', 'Slack Group']"
19210843,Snowplow Analytics Boston,Snowplow-Analytics-Boston,http://www.meetup.com/Snowplow-Analytics-Boston/,0.0,1450090954000,"This is a platform specific group for anyone interested in event level
analytics. All skill levels are welcome. The goal of this group is to help the
analytical community better grasp owning and managing their own data.

",Alex Dean,12133214.0,"['platform', 'group', 'event', 'level', 'analytics', 'skill levels', 'goal', 'analytical community', 'owning', 'managing', 'data']"
18649702,Boston React Native Meetup,Boston-React-Native-Meetup,http://www.meetup.com/Boston-React-Native-Meetup/,0.0,1433455309000,"React Native is a new and exciting way to develop native apps on mobile
devices. We'll discuss various challenges and discoveries that we encounter
while programming in React Native. We'll participate in programming challenges
and we'll all learn together.

",Bill Sullivan,9490298.0,"['React Native', 'native', 'apps', 'mobile\ndevices', 'challenges', 'discoveries', 'programming']"
15149672,New England Association for Information Science & Technology,neasist,http://www.meetup.com/neasist/,5.0,1403037657000,"Welcome to NEASIST, the [New England Chapter](http://neasist.org/) of the
[Association for Information Science and Technology](http://asist.org/). The
mission of the association is to advance the information sciences and related
applications of information technology by providing focus, opportunity, and
support to information professionals and organizations. Through informal
discussions, networking dinners, conferences, and guest speakers, NEASIST
brings together the region’s computer scientists, librarians, lawyers,
engineers, educators, and anyone interested in advancing knowledge about
information, its creation, properties, and use.

",NEASIST,152030522.0,"['Welcome', 'NEASIST', 'New England Chapter](http://neasist.org/', 'Association for Information Science', 'Technology](http://asist.org/', 'mission', 'association', 'advance', 'information', 'sciences', 'applications', 'information technology', 'information professionals', 'organizations', 'informal', 'discussions', 'networking dinners', 'conferences', 'guest speakers', 'region', 'computer scientists', 'librarians', 'lawyers', 'engineers', 'educators', 'creation', 'properties']"
19185426,Metrowest Web Technology Meetup,Metrowest-Web-Technology-Meetup,http://www.meetup.com/Metrowest-Web-Technology-Meetup/,0.0,1449359592000,"This is a group for anyone interested in working on the next generation of
mobile, connected devices. Particularly the Internet of Things. We will be
looking at Ruby on Rails, Python, HTML5, CSS, JSON, a number of other
technologies as they arise, and each other.

",Matt,4415649.0,"['group', 'working', 'next generation', 'mobile', 'connected devices', 'Internet of Things', 'Ruby', 'Rails', 'Python', 'HTML5', 'CSS', 'JSON', 'technologies']"
18244216,Boston Open Source Ed Tech Meetup,Boston-Open-Source-Ed-Tech-Meetup,http://www.meetup.com/Boston-Open-Source-Ed-Tech-Meetup/,0.0,1418198098000,"A forum for people interested in discovering, developing, integrating, and
evangelizing open source tools that make education more accessible and
effective.

",Brad Smith,147563782.0,"['forum', 'people', 'education', 'effective']"
16622212,Big Data Women,Big-Data-Women,http://www.meetup.com/Big-Data-Women/,5.0,1409097905000,"We are open to men and women interested in solving hardcore big data problems,
but we focused on women because most of the big data Meetups are dominated by
men and we feel women add another perspective. So while we are marketing this
to women, men are most certainly welcome.

Our goal is to have at least one Meetup per month.  More would be awesome!
Please feel free to write spontaneously to the organizer with suggestions for
Meetup locations and times that would be best for you.  The goal is to get
everyone together for some awesome conversations!

  

  

",Monika Wahi,12983188.0,"['men', 'women', 'hardcore', 'data problems', 'data', 'Meetups', 'goal', 'Meetup', 'month', 'spontaneously', 'organizer', 'suggestions', 'Meetup locations', 'awesome conversations']"
4379272,Boston Imaging and Vision (BIV),bostonimagevision,http://www.meetup.com/bostonimagevision/,4.58,1343097109000,"The Boston Imaging and Vision (BIV)  meetup provides an opportunity for the
image processing/computer vision community to network, socialize and learn. It
covers the basics as well as advanced subjects, and the hottest and latest
developments in areas such as biomedical and mobile applications. The meetup
organizes regular events. both for folks around Cambridge/Boston, and around
the i95 loop. The goal is to provide:  

Presentations from passionate speakers (contact us if you would like to talk
or invite a speaker);

Occasional workshops,  tutorials, and networking events;

A marketplace for consultants and companies needing image processing/computer
vision.

  

",Youssef  Rouchdy,35841382.0,"['Boston Imaging and Vision', 'BIV', 'image', 'processing/computer vision', 'community', 'network', 'socialize', 'learn', 'advanced subjects', 'hottest', 'developments', 'biomedical', 'mobile applications', 'meetup', 'regular events', 'Cambridge/Boston', 'i95 loop', 'goal', 'Presentations', 'passionate speakers', 'contact', 'speaker', 'Occasional workshops', 'tutorials', 'networking events', 'marketplace', 'consultants', 'companies', 'image processing/computer\nvision']"
