id,name,urlname,link,rating,created,description,organiserName,organiserMemberId,tags
19065938,The Boston Blockchain Voting Group,The-Boston-Blockchain-Voting-Group,http://www.meetup.com/The-Boston-Blockchain-Voting-Group/,5.0,1445954374000,"This is a group for those who think democracy should more accessible through
the internet, and are interested in pushing for a decentralized Blockchain
voting system in Boston, and its surrounding territories.

Don’t make the mistake of thinking that progress is inevitable and that
someone smarter or more capable than you is already working on it. The truth
is that the future is dependent on the actions of individuals. Progress really
happens when smart people get together, and work hard to solve the right
problems, in the right way, at the right time. Let's get together and make
this happen!

This group's goal is to organize around things like creating media, like
infographics and videos to explain the concept in plain and persuasive terms,
engaging and involving the public in a dialogue about our mission through
events, petitions, and canvassing, reaching out to media such as blogs,
podcasts, and general news, and conducting talks in relevant forums.

The final goal is to build up a clear vision, and bring the idea to the
Government, to be used in elections and referendums. I encourage each of you
to join me in constructing a more free, and transparent future.  

",Joseph P Thornton III,192589352.0,"['group', 'democracy', 'internet', 'pushing', 'decentralized', 'Blockchain', 'voting system', 'Boston', 'territories', 'progress', 'working', 'future', 'dependent', 'actions', 'individuals', 'smart people', 'right\nproblems', 'right way', 'right time', ""group's"", 'goal', 'media', 'infographics', 'videos', 'concept', 'plain', 'persuasive', 'engaging', 'public', 'dialogue', 'mission', 'events', 'petitions', 'canvassing', 'blogs', 'podcasts', 'general news', 'relevant', 'forums', 'vision', 'Government', 'elections', 'referendums', 'free', 'transparent']"
13546582,Beantown Big Datafins - Big Data and Financial Services,beantown-bigdatafins,http://www.meetup.com/beantown-bigdatafins/,2.67,1395770986000,"it's a meetup that routinely meets to discuss how Big Data Analytics ties into
the Financial Services world.

",Kim Booth,107036372.0,"['meetup', 'Big Data Analytics', 'ties', 'Financial Services']"
19995753,Quantrix - Next Generation Financial Spreadsheets,Quantrix-Spreadsheets-Meetup,http://www.meetup.com/Quantrix-Spreadsheets-Meetup/,0.0,1464200381000,"Do you make business decisions by modeling data and information? Great. Are
you ready to create, manage and share your models easier than ever? Now we're
talking. You're beyond spreadsheets, and so are we.

In this group, we'll be discussing use cases, delving into sample models, and
learning from one another. We're looking to facilitate information-sharing,
networking, and knowledge development. And we might preview a new feature or
two ;-) This is not your average user group, but it is an opportunity to
expand/explore your horizons in predictive modeling while getting a peek
behind the curtain of a growing analytics software company.

We're aiming to hold events in Boston and NYC quarterly. Stay tuned for
expansion to other regions of the U.S!

About Quantrix: Quantrix Modeler multi-dimensional calculation engine pushes
beyond the performance limits of traditional spreadsheets to enable integrated
planning with features like always-on pivoting and scenario modeling. Used by
finance, sales, risk, engineering and scientific professionals as well as
policy researchers and business consultants, Quantrix' customer base includes
more than 1,100 customers in 50 countries.

",Tom Ahern,190597892.0,"['business', 'decisions', 'modeling', 'data', 'information', 'Great', 'manage', 'models', 'talking', 'spreadsheets', 'group', 'cases', 'sample models', 'learning', 'information-sharing', 'networking', 'knowledge development', 'preview', ';-)', 'user group', 'horizons', 'predictive modeling', 'curtain', 'analytics', 'software company', 'events', 'Boston', 'NYC', 'quarterly', 'expansion', 'regions', 'U.S', 'Quantrix', 'performance', 'limits', 'traditional', 'planning', 'features', 'always-on pivoting', 'finance', 'sales', 'risk', 'engineering', 'scientific professionals', 'policy researchers', 'business consultants', ""Quantrix'"", 'customers', 'countries']"
7166482,ICT4D Boston,ICT4D-Boston,http://www.meetup.com/ICT4D-Boston/,4.62,1360770728000,"This a group for anyone interested in the research, design, implementation and
analysis of Information and Communication Technologies (ICT) for Development.
We started this group because there are many of us in Boston and it would be
fun to hang out together.

Feel free to join our email discussion list at:
<https://groups.google.com/d/forum/ict4d-boston>

Both programmers and non-programmers are welcome.

  
  

",Leo Burd,2089619.0,"['group', 'research', 'design', 'implementation', 'analysis', 'Information', 'Communication Technologies', 'ICT', 'Development', 'Boston', 'email', 'programmers', 'non-programmers']"
18592884,Open edX Boston,Open-edX-Boston,http://www.meetup.com/Open-edX-Boston/,4.75,1431454149000,"A Boston-based group of Open edX enthusiasts. You could be an educator, a
developer, an entrepreneur, a learner, or really anyone who wants to learn
more about Open edX, the open source online learning platform that powers
edX.org.

",Ned Batchelder,1824278.0,"['Boston-based group', 'Open edX enthusiasts', 'educator', 'developer', 'entrepreneur', 'learner', 'Open edX', 'powers', 'edX.org']"
3673212,Virtualization Meetup Group–Boston,VirtGBoston,http://www.meetup.com/VirtGBoston/,4.89,1334498408000,"The Virtualization Group–Boston is a volunteer run, professional association,
which exists in order to encourage an exchange of knowledge about all aspects
of virtualization, green technology and cloud computing between IT
Professionals. Furthermore, we will foster affiliation with similar
virtualization groups located elsewhere to expand the reach of knowledge and
training resources.

",Peter Larson,14902221.0,"['Virtualization Group', 'volunteer run', 'professional association', 'exchange', 'knowledge', 'virtualization', 'green technology', 'cloud computing', 'IT', 'Professionals', 'affiliation', 'groups', 'training', 'resources']"
19735680,Agile Product Open,Agile-Product-Open,http://www.meetup.com/Agile-Product-Open/,5.0,1458509789000,"Bringing Agile principles to Product Management Together, we share ways Agile
principles and practices enable us to increase our capacity to deliver
products that please our customers, satisfy our business sponsors, build
collaborative development communities, and change the world through great
products that matter.

",Vanessa Ferranto,25816642.0,"['Agile principles', 'Product Management', 'Agile', 'principles', 'practices', 'increase', 'capacity', 'products', 'customers', 'business sponsors', 'collaborative development', 'communities', 'change', 'world']"
19649729,Boston Tech Lovers,Boston-Tech-Lovers,http://www.meetup.com/Boston-Tech-Lovers/,5.0,1456874682000,"This is a group for anyone who is interested to learn about Apache Cassandra
from Scratch to build clusters into it. All skill levels are welcome. I
started this group to encourage people to learn more about new technologies,
enhance their skills and get competitive jobs. Let's get together for most
affordable training in MA for new technologies. We will serve lunch. Lets
enjoy learning together.

",Guru Virtues,197945021.0,"['group', 'Apache Cassandra', 'Scratch', 'clusters', 'skill levels', 'people', 'technologies', 'enhance', 'skills', 'competitive jobs', 'training', 'MA', 'lunch', 'learning']"
1676436,Boston Predictive Analytics,Boston-Predictive-Analytics,http://www.meetup.com/Boston-Predictive-Analytics/,4.46,1279305336000,"The goal of this meetup is present informative lectures, hands-on tutorials,
networking events, etc, towards helping the local community further it's
understanding and proficiency regarding Predictive Analytics. Our group has
three main focal points: business applications, advanced mathematics, and
computer science; with topics covering Recommeder Systems, Machine Learning,
Google Analytics, Data Visualization, Social Media / Text Analytics, and
related topics. Predictive Analytics are leveraged across many industries, job
functions, software applications; and is not just about Google Analytics.

",John Verostek,2220559.0,"['goal', 'meetup', 'lectures', 'hands-on tutorials', 'networking events', 'local', 'community', 'proficiency', 'Predictive Analytics', 'group', 'focal points', 'business', 'applications', 'advanced mathematics', 'computer science', 'topics', 'Recommeder Systems', 'Machine Learning', 'Google Analytics', 'Data Visualization', 'Social Media', 'Text Analytics', 'industries', 'job', 'functions', 'software applications']"
18621589,Boston Software Architecture Meetup,Boston-Software-Architecture-Meetup,http://www.meetup.com/Boston-Software-Architecture-Meetup/,0.0,1432484979000,"Being a software architect require both considerable knowledge and technical
skills. Additionally it’s a continuing struggle to keep up to date with a
constantly changing technology landscape. The goal of this Meetup is to help
both aspiring and veteran software architects and senior developers stay
current with emerging technologies, share their experiences, and learn new
tools, technologies, practices and methodologies.

",Sheamus McGovern,14106978.0,"['Being', 'software architect', 'knowledge', 'technical', 'skills', 'technology', 'landscape', 'goal', 'Meetup', 'aspiring', 'veteran software', 'senior developers stay', 'current', 'technologies', 'experiences', 'tools', 'practices', 'methodologies']"
3443862,Bio-Entrepreneurs Forum,Bio-Entrepreneurs-Forum,http://www.meetup.com/Bio-Entrepreneurs-Forum/,4.88,1331259284000,"Meet a new network of New England's bio entrepreneurs from business, academic,
finance, scientific and medical communities. Our forum consists of discussions
on emerging research and the commercialization and development of new
technologies encompassing biotech, nanotech, pharmaceuticals, medical devices,
environmental technology, information technology, healthcare, cell biology,
life science research, pharmaceuticals, and drug discovery start-ups.

It was designed for multi-disciplinary entrepreneurs and researchers to
commercialize science and technology for Health and Medicine and for those
interested in building, sustaining and investing in a thriving New England
biotech cluster through innovation, collaboration and networking.

Network with like-minded founders, industry experts, angel and venture capital
investors, and successful entrepreneurs.

Like us on Facebook: <http://www.facebook.com/bioentrepreneurs>

Follow us on Twitter: <https://twitter.com/BioEntreprenR>

",Peter ,6855667.0,"['network', ""New England's bio entrepreneurs"", 'business', 'academic', 'finance', 'scientific', 'medical communities', 'forum', 'discussions', 'research', 'commercialization', 'development', 'technologies', 'biotech', 'nanotech', 'pharmaceuticals', 'medical devices', 'environmental technology', 'information technology', 'healthcare', 'cell biology', 'life science research', 'drug discovery start-ups', 'multi-disciplinary entrepreneurs', 'researchers', 'commercialize', 'science', 'technology', 'Health', 'building', 'sustaining', 'thriving New England', 'biotech cluster', 'innovation', 'collaboration', 'networking', 'Network', 'like-minded founders', 'industry experts', 'angel', 'venture', 'capital', 'investors', 'entrepreneurs', 'Facebook', 'http://www.facebook.com/bioentrepreneurs', 'Twitter', 'https://twitter.com/BioEntreprenR']"
18431128,Boston Netezza Meetup,Boston-Netezza-Meetup,http://www.meetup.com/Boston-Netezza-Meetup/,0.0,1423777234000,"This Meetup is for any existing PureData for Analytics (aka Netezza) customers
who want to swap hints, tips, stories, questions, or experiences. It's also
for anybody interested in learning more about how to perform complex
statistical or geographical analysis on terabytes of data (e.g. customer,
transaction, clickstream, social, etc.) in seconds flat, perhaps as part of a
Big Data integration strategy. We'll also try and get someone from IBM along
to update us on the latest developments in the Information Management space.

",Huw Ringer,62673122.0,"['Meetup', 'PureData for Analytics', 'customers', 'swap', 'tips', 'stories', 'questions', 'experiences', 'learning', 'complex', 'statistical', 'geographical analysis', 'terabytes', 'data', 'customer', 'transaction', 'clickstream', 'social', 'seconds flat', 'Big Data integration strategy', 'IBM', 'Information Management space']"
19131550,Sandstorm Boston,Sandstorm-Boston,http://www.meetup.com/Sandstorm-Boston/,5.0,1447793569000,"Sandstorm is an open source operating system for personal and private clouds.
Sandstorm is the easiest way you've ever seen to run [Google Drive alternative
](https://opensource.com/life/15/12/5-open-source-web-apps-self-hosted)web
apps like Etherpad, Davros, SandForms, Hacker Slides, and Etherpad on your own
server. We also have other great web apps like Gitlab, Rocket.Chat, WordPress,
and Wekan on our [App Market](https://apps.sandstorm.io/).  
  
Meet Sandstorm's core developers as well as users, app developers, and people
who are excited to run Sandstorm for themselves or for their company. We'll
learn from each other, share info about apps we like and apps we wrote, and
have conversations about where Sandstorm should go next. Please join us!  
  
For more information about Sandstorm:  
[www.sandstorm.io](http://www.sandstorm.io/)

Twitter:  
[www.twitter.com/Sandstormio](https://twitter.com/Sandstormio)

Facebook:  
[www.facebook.com/sandstorm.io](https://www.facebook.com/sandstorm.io)

Google+:  
[www.plus.google.com/+SandstormIo](https://plus.google.com/+SandstormIo)

Blank Sandstorm-themed slides for your talks can be found
[here](https://docs.google.com/presentation/d/1niJzuaJlC6VmxIVWdi88EP7mvAl6VX3f0vpF70nIf-4/edit#slide=id.p).

",Jade Wang,13390388.0,"['Sandstorm', 'personal', 'private clouds', 'Google Drive alternative', 'apps', 'Etherpad', 'Davros', 'SandForms', 'Hacker Slides', 'server', 'Gitlab', 'Rocket', 'WordPress', 'Wekan', 'App Market](https://apps.sandstorm.io/', 'users', 'app developers', 'people', 'excited', 'company', 'info', 'conversations', 'information', 'Twitter', '[www.twitter.com/Sandstormio](https://twitter.com/Sandstormio', 'Facebook', 'Google+', '[www.plus.google.com/+SandstormIo](https://plus.google.com/+SandstormIo', 'Blank', 'Sandstorm-themed slides']"
3179682,Emerging Business,emerging-business,http://www.meetup.com/emerging-business/,4.53,1327689960000,"The Emerging Business meetup is a group of like-minded individuals who are
constantly striving to move the web forward via the latest trends,
technologies, and processess. Occasionally, we get together to discuss new and
better ways to grow our businesses, show off what we've been working on, and
talk about the bleeding edge of development.

Our purpose is to:

Educate startups and enterprises on the latest technologies

Help entrepreneurs grow their businesses

Help bring entrepreneurial thinking to the enterprise

",Gary,183310138.0,"['Business meetup', 'group', 'like-minded', 'individuals', 'web forward', 'trends', 'technologies', 'processess', 'businesses', 'working', 'talk', 'bleeding edge', 'development', 'Educate startups', 'enterprises', 'entrepreneurs grow', 'entrepreneurial thinking', 'enterprise']"
18842792,AllJoyn Boston,AllJoyn-Boston,http://www.meetup.com/AllJoyn-Boston/,5.0,1439846245000,"Meet other developers interested in AllJoyn. AllJoyn® is a collaborative open-
source software framework that makes it easy for devices and apps to discover
and communicate with each other. It supports many language bindings and can be
easily integrated into platforms small and large. The AllJoyn framework
defines a common way for devices and apps to communicate with one another
ushering a new wave of interoperable devices to make the Internet of Things a
reality. Learn more about AllJoyn at https://allseenalliance.org/developers

",AllJoyn,190963340.0,"['developers', 'AllJoyn', 'AllJoyn®', 'collaborative', 'source software', 'devices', 'apps', 'language', 'bindings', 'platforms', 'small', 'large', 'framework', 'wave', 'interoperable devices', 'Internet', 'reality', 'https://allseenalliance.org/developers']"
20374721,Serverless Boston,Serverless-Boston,http://www.meetup.com/Serverless-Boston/,0.0,1472672162000,"The future is serverless with AWS Lambda, Azure Functions, Google Cloud
Functions, IBM OpenWhisk, and others. On-demand serverless compute, Function
as a Service (FaaS), combined with existing cloud services allows the cloud
itself to become programmable. Specifically, cloud services are the components
for building applications (web, mobile, IoT).  

Short-term plan:  Start small and grow membership with those who are truly
interested in the next generation of cloud computing. We can model our
approach similar to other (serverless) meetups worldwide (organizational
meetings, presentations by members/guests, networking).  

  

  

  

",Wayne Scarano,130507282.0,"['future', 'serverless', 'AWS Lambda', 'Azure Functions', 'Google Cloud\n', 'Functions', 'IBM', 'OpenWhisk', 'On-demand serverless', 'Function', 'Service', 'FaaS', 'cloud services', 'cloud', 'programmable', 'components', 'web', 'mobile', 'IoT', 'Short-term', 'plan', 'Start small', 'grow', 'membership', 'interested', 'generation', 'cloud computing', 'model', 'meetups', 'organizational', 'meetings', 'presentations', 'members/guests', 'networking']"
19983564,Boston Bayesians,Boston-Bayesians,http://www.meetup.com/Boston-Bayesians/,4.89,1463954135000,"Welcome to the Boston Bayesians Meetup group.

We are a small group of data scientists, statisticians, engineers and
researchers interested in the practical applications of Bayesian statistics.
Join us for friendly academic briefings, stories from real-world projects, and
open discussion of Bayesian inference, tools, techniques and case studies.

We follow a conventional format of 1 or 2 presentations from volunteers in the
group and/or invited experts, and general conversation and socialising
afterwards. Think of us as your Bayesian self-help group in the Boston Area.

Some topics of interest are:

\- Bayesian Data Analysis.  
\- Probabilistic programming with PyMC3, STAN, others.  
\- Model checking and comparison techniques.  
\- Computational methods for approximate Inference.  
\- Real-world examples of hierarchical models.  
\- Bayesian methods for Machine Learning and deep learning.  
\- Bayesian methods for Reinforcement Learning.  
\- Non-linear and non-parametric models.

Call for presentations:

We provide a supporting environment to share your ideas and get feedback on
your work. If you are interested in presenting, please submit presentation
proposals at BostonBayesians@gmail.com.

Follow us on Twitter: @BostonBayesians

  

",Jordi Diaz,14462556.0,"['Welcome', 'Boston Bayesians', 'data scientists', 'statisticians', 'engineers', 'researchers', 'Bayesian statistics', 'academic briefings', 'stories', 'real-world projects', 'Bayesian inference', 'tools', 'techniques', 'case studies', 'conventional', 'presentations', 'volunteers', 'group', 'invited', 'experts', 'general conversation', 'socialising', 'Bayesian', 'Boston Area', '\\-', 'Probabilistic programming', 'PyMC3', 'STAN', 'Model', 'checking', 'comparison', 'Computational methods', 'approximate Inference', 'Real-world examples', 'hierarchical models', 'Bayesian methods', 'Machine Learning', 'deep learning', 'Reinforcement Learning', 'Non-linear', 'non-parametric models', 'environment', 'ideas', 'feedback', 'presenting', 'presentation', 'proposals', 'BostonBayesians@gmail.com', 'Twitter']"
1850581,Node.JS Boston,Node-JS-Boston,http://www.meetup.com/Node-JS-Boston/,4.51,1305236157000,"A group dedicated to Node.JS, the server side framework for Google's V8
JavaScript engine.

",Freedom Dumlao,26364022.0,"['group', 'Node', 'JS', 'server side framework', ""Google's V8\nJavaScript engine""]"
1336198,Cambridge Semantic Web,The-Cambridge-Semantic-Web-Meetup-Group,http://www.meetup.com/The-Cambridge-Semantic-Web-Meetup-Group/,4.51,1228962294000,"Meet local professionals, entrepreneurs and enthusiasts interested in the
Semantic Web and related technologies.

",Kingsley Idehen,3320828.0,"['Meet local professionals', 'entrepreneurs', 'enthusiasts', 'Semantic Web', 'technologies']"
18547930,Boston Mesos User Group,Boston-Mesos-User-Group,http://www.meetup.com/Boston-Mesos-User-Group/,0.0,1429052199000,"This group is focused on promoting Apache Mesos as a platform for creating
distributed systems. Topics will include ops and tools for running Mesos on
public cloud infrastructure or in a private data center, data processing with
Spark, real time data processing with Storm and how to build custom
schedulers.

",Kiersten Gaffney,182994028.0,"['group', 'Apache Mesos', 'systems', 'ops', 'tools', 'running Mesos', 'public cloud infrastructure', 'private data center', 'data processing', 'Spark', 'real time data processing', 'Storm', 'schedulers']"
2727132,Xamarin,Xamarin,http://www.meetup.com/Xamarin/,0.0,1319910722000,"For developers and enthusiasts of Mono and Xamarin's MonoTouch and Mono for
Android platforms. Let's get together and share tips and tricks for writing
iPhone, iPad and Android apps with .NET.

",James Montemagno,110883512.0,"['developers', 'enthusiasts', 'Mono', ""Xamarin's"", 'MonoTouch', 'Android platforms', 'tips', 'tricks', 'writing', 'iPhone', 'iPad', 'Android apps', '.NET']"
18619618,Boston Area Trans Tech Enthusiasts,Boston-Area-Trans-Tech-Enthusiasts,http://www.meetup.com/Boston-Area-Trans-Tech-Enthusiasts/,0.0,1432401176000,"This is a social group for people who identify as transgender, gender non
conforming, gender non binary, gender diverse, gender fluid, or anywhere
outside of the gender binary, or are questioning their gender, who are working
or interested in working in tech. Let's get together and talk about the
challenges we face and what we can do to make the tech world a friendlier
place for us.  We never have an agenda, just a set time and place to hang out.

",Cody Mattes,185501492.0,"['social group', 'people', 'transgender', 'gender non', 'gender non binary', 'gender', 'diverse', 'gender fluid', 'gender binary', 'questioning', 'working', 'tech', 'talk', 'challenges', 'face', 'tech world', 'friendlier', 'agenda']"
5305572,Data Management Association of New England,Data-Management-Association-of-New-England,http://www.meetup.com/Data-Management-Association-of-New-England/,4.42,1349747571000,"DAMA' goals are to: Help practitioners become more knowledgeable and skilled
in the information and data management profession Influence practices,
education and certification in the information and data management profession
Support DAMA members and their organizations to address their information and
data management needs Form alliances with other organizations with similar
principles to strengthen the profession. The purpose of this meetup is to
support these goals, and to provide networking opportunities for data
professionals in New England.

",David,3721036.0,"['DAMA', 'goals', 'practitioners', 'knowledgeable', 'skilled', 'information', 'data management', 'profession', 'practices', 'education', 'certification', 'Support', 'members', 'organizations', 'Form alliances', 'principles', 'meetup', 'networking', 'data', 'professionals', 'New England']"
17339622,MetroWest JS,MetroWest-JS,http://www.meetup.com/MetroWest-JS/,4.67,1412186676000,"This group is for anyone in the Metrowest area interested in Javascript. From
frontend technologies like jQuery, AngularJS, Ember and D3.js to backend
technologies like NodeJS and Express to NodeBots and the IoT. Javascript all
the things!

",Philip Borenstein,10586500.0,"['group', 'Metrowest area', 'Javascript', 'frontend technologies', 'jQuery', 'AngularJS', 'Ember', 'D3.js', 'backend', 'technologies', 'NodeJS', 'Express', 'NodeBots', 'IoT. Javascript']"
18140402,Verizon Cloud Hackathon Boston Meetup,Verizon-Cloud-Hackathon-Boston-Meetups,http://www.meetup.com/Verizon-Cloud-Hackathon-Boston-Meetups/,0.0,1415385945000,"This is a Meetup for the Developer and Cloud Computing community. Both IaaS,
PaaS Open Source, Applications and computing technology will be discussed.
It's a chance for developers, professionals, researchers, and enthusiasts in
the Dallas area to come together.

The Verizon Global Wholesale Cloud Team is looking for ways to drive cloud
adoption of the Verizon Cloud Platform. We are looking for Hackers to
brainstorm and create new and exciting apps that run on the Verizon Cloud and
leverage technologies from Verizon's multiple platforms (Verizon Wireless,
FioS, Edgecast, Telematics and the Verizon Enterprise Network) as well as
those of our Partners.

What your Meetup Group is about: Development of Apps that reside on the
Verizon Cloud Platform and Accelerating adoption and usage of the Verizon
Cloud.

Who should join: Developers and Cloud Enthusiasts  
What members can expect of the group, and what you expect of them: Have fun
and get the opportunity to develop apps on the Verizon Cloud.

",Verizon Cloud Hackathon Team,182173952.0,"['Meetup', 'Developer', 'IaaS', 'PaaS Open Source', 'Applications', 'computing technology', 'developers', 'professionals', 'researchers', 'enthusiasts', 'Dallas area', 'Verizon', 'cloud', 'adoption', 'Verizon Cloud Platform', 'Hackers', 'brainstorm', 'apps', 'Verizon Cloud', ""Verizon's multiple platforms"", 'Verizon Wireless', 'FioS', 'Edgecast', 'Telematics', 'Verizon Enterprise Network', 'Partners', 'Meetup Group', 'Development', 'usage', 'Verizon\n', 'Developers', 'Cloud Enthusiasts', 'group']"
