id,name,urlname,link,rating,created,description,organiserName,organiserMemberId,tags
18616327,Modern JavaScript,modern-javascript,http://www.meetup.com/modern-javascript/,4.85,1432259774000,"Passionate about JavaScript, or want to learn why others are? Modern
JavaScript is a regular meetup of technologists looking to improve their
development skills and network with others. We have a flexible agenda.
Sometimes we have presentations. Sometimes we get together to learn by hacking
something together or using NodeSchool.

",Gary J Chamberlain,86478162.0,"['Passionate', 'JavaScript', 'technologists', 'improve', 'development skills', 'network', 'agenda', 'presentations', 'hacking', 'NodeSchool']"
19232780,Boston Connected & Intelligent Device Meetup,Boston-Connected-Intelligent-Device-Meetup,http://www.meetup.com/Boston-Connected-Intelligent-Device-Meetup/,4.89,1450807465000,"Hardware is dead. Long live hardware!

There is no question that hardware has been white-hot these past few years.
Exits such as Nest and Oculus Rift are just some of the more recent data
points in why hardware is hot.

There is plenty that we know about hardware. We know for instance that
hardware is hard. We know that mass manufacturing is fraught with difficulty.
We know that the proliferation of Adruinos and Raspberry Pis have lowered the
barrier to hardware entry.

We also know that not all hardware is the same. Certainly something like the
Nest Thermostat is intrinsically different from something like the hoverboard,
even though both are fundamentally made up of the same components, such as a
processing unit, PCB board & assembly, sensors, casing, etc.

What is it about the Nest Thermostat, or even the Autonomous Car that sets it
apart from the ""onesy"" pieces of hardware such as the hoverboards or ""dumb""
cars?

The answer, IMHO, is the Connectivity and Intelligence that is built into one
set of devices versus the other. A Connected and Intelligent device is more
than just a piece of hardware -- it has the capacity to learn from its peer-
device, change its behavior over time, and become integrated into- rather than
just be added onto- a consumer's life.

Connected & Intelligent devices have requirements that extend those which we
traditionally think of as being ""merely"" hardware. On top of everything from
the traditional component selection, prototyping, manufacturing, etc., each of
these devices now also has to contend with issues such as privacy, security,
networking, authentication, etc.

This difference, again IMHO, is what sets apart the Hardware 2.0 era of Smart
Home, Smart City, and Smart AllSortsOfThings from their predecessors. The
Boston Connected & Intelligent Device Meetup is intended to be a platform for
discussion, design, growth, and promotion of such devices.

",Babak Kia,64960062.0,"['Hardware', 'dead', 'Long live hardware', 'hardware', 'years', 'Exits', 'Nest', 'Oculus Rift', 'data', 'hot', 'mass manufacturing', 'difficulty', 'proliferation', 'Adruinos', 'Raspberry', 'barrier', 'Nest Thermostat', 'hoverboard', 'components', 'processing unit', 'PCB', 'assembly', 'sensors', 'casing', 'Autonomous Car', 'hoverboards', 'cars', 'IMHO', 'Connectivity', 'Intelligence', 'devices', 'Connected', 'Intelligent device', 'capacity', 'peer-\ndevice', 'behavior', 'time', ""consumer's life"", 'Intelligent devices', 'requirements', 'prototyping', 'manufacturing', 'issues', 'privacy', 'security', 'networking', 'authentication', 'difference', 'Smart\nHome', 'Smart City', 'Smart AllSortsOfThings', 'predecessors', 'discussion', 'design', 'growth', 'promotion']"
2877472,The Boston Vim Meetup,The-Boston-Vim-Meetup,http://www.meetup.com/The-Boston-Vim-Meetup/,4.83,1322532641000,"As ardent vim fans, a few thoughtbotters thought a Boston Vim Meetup could be
an awesome idea. Our first meeting took place in October '11 and much fun was
had by all. This meetup is open to all current and aspiring vim users who
wanna talk motions, macros, and mappings.

",Chris Toomey,12522370.0,"['ardent', 'fans', 'thoughtbotters', 'Boston Vim Meetup', 'meeting', 'meetup', 'current', 'aspiring', 'users', 'motions', 'macros', 'mappings']"
4323362,Windows Boston   (BAWSUG),WindowsBoston,http://www.meetup.com/WindowsBoston/,4.65,1342485189000,"The Windows Server Group is a volunteer run, professional association, which
exists in order to encourage an exchange of knowledge about all aspects of
Windows Server Technology between IT Professionals. We help IT Managers and
Administrators deploy Windows Server Technologies within the enterprise, on
the internet and in the Cloud.

",Clyde Johnson,55063252.0,"['Windows Server Group', 'volunteer run', 'professional association', 'exchange', 'knowledge', 'Windows Server Technology', 'IT', 'Managers', 'Administrators', 'Windows Server Technologies', 'enterprise', 'internet', 'Cloud']"
18815026,Boston Gay Computer Engineers,Boston-Gay-Computer-Engineers,http://www.meetup.com/Boston-Gay-Computer-Engineers/,5.0,1439098174000,"Do you like computering really hard? Enjoy a discussion about how yum is
terrible and will always break? Are you someone trying to move away from
thousands of case statements all in one method? Then you should join us for
beers, discussion, alcohol, computers, alcohol, and experiences you probably
won't regret.

",Drew Hunt,186884892.0,"['computering', 'discussion', 'yum', 'case statements', 'method', 'beers', 'alcohol', 'computers', 'experiences']"
18712628,Boston Streams,Boston-Streams,http://www.meetup.com/Boston-Streams/,0.0,1435781124000,"Have you ever wondered how Netflix delivers movies to your home with a flick
of a tile? or how Twitter keeps your tweets flowing to deliver you breaking
news? or how Tesla knows when to notify its drivers when to service their
electric vehicle? If so, join us in this exciting new meetup to uncover the
mysteries of continuous data flows and how to build robust stream computing
environments. We're looking for speakers, enthusiasts, hackers, and innocent
bystanders to join us for food and drink in and around your area.

",Nancy Berlin,200241805.0,"['Netflix', 'movies', 'home', 'flick', 'tile', 'Twitter', 'tweets', 'flowing', 'news', 'Tesla', 'drivers', 'service', 'electric vehicle', 'continuous data flows', 'robust', 'stream computing', 'environments', 'speakers', 'enthusiasts', 'hackers', 'innocent', 'bystanders', 'food', 'drink', 'your area']"
10586462,Hacking Somerville Happiness,Hacking-Somerville-Happiness,http://www.meetup.com/Hacking-Somerville-Happiness/,4.5,1381158665000,"It's difficult to improve what you can't measure, and difficult to measure
something that everyone defines differently. Join fellow hackers, Quantified
Selfers, and the [City of Somerville](http://somervillema.gov) as we tackle
both challenges in a pilot to quantify, visualize, and improve subjective
citizen well-being in Somerville.

For more details, check out our [about page](http://www.meetup.com/The-
Happathon-Project-Hacking-Common-Wealth-Happiness/about/).

",Adam Laughlin,7818021.0,"['improve', 'measure', 'everyone defines', 'Join fellow hackers', 'Quantified', 'Selfers', 'City', 'Somerville](http://somervillema.gov', 'quantify', 'visualize', 'subjective', 'citizen', 'well-being', 'Somerville', 'page](http://www.meetup.com/The-\nHappathon-Project-Hacking-Common-Wealth-Happiness/about/']"
2469942,Boston Data Visualization,bostondatavis,http://www.meetup.com/bostondatavis/,4.66,1315790452000,"Boston has an amazing group of people who not only create beautiful data
visualization work, but also push the entire field forward with their
contribution to the open source and academic communities. This meetup will aim
to bring those people and anyone interested in data visualization together,
fostering a community, creating a space for learning and enabling new
partnerships. The meetup will host talks, hack days, workshops/tutorials and
personal work showcases. If you would like to speak at a monthly meetup please
contact Irene Ros (irene at bocoup.com).

[Submit and vote for talks here](https://productpains.com/product/boston-data-
visualization-meetup?tab=top)!

",Irene,7548472.0,"['Boston', 'group', 'people', 'data', 'visualization', 'field forward', 'source', 'academic', 'communities', 'meetup', 'data visualization', 'community', 'space', 'learning', 'partnerships', 'host', 'talks', 'hack days', 'workshops/tutorials', 'personal work', 'monthly', 'meetup please', 'contact', 'Ros', 'irene', 'bocoup.com)', 'vote', 'here](https://productpains.com/product/boston-data-', 'visualization-meetup?tab']"
11096122,CloudStack Boston User Group,CloudStack-Boston-User-Group,http://www.meetup.com/CloudStack-Boston-User-Group/,0.0,1384386390000,"**What is Apache CloudStack?**

Apache CloudStack is open source software designed to deploy and manage large
networks of virtual machines, as a highly available, highly scalable
Infrastructure as a Service (IaaS) cloud computing platform. CloudStack is
used by a number of service providers to offer public cloud services, and by
many companies to provide an on-premises (private) cloud offering, or as part
of a hybrid cloud solution.

CloudStack is a turnkey solution that includes the entire ""stack"" of features
most organizations want with an IaaS cloud: compute orchestration, Network-as-
a-Service, user and account management, a full and open native API, resource
accounting, and a first-class User Interface (UI).

CloudStack currently supports the most popular hypervisors: VMware, KVM,
XenServer and Xen Cloud Platform (XCP).  
Users can manage their cloud with an easy to use Web interface, command line
tools, and/or a full-featured RESTful API. In addition, CloudStack provides an
API that's compatible with AWS EC2 and S3 for organizations that wish to
deploy hybrid clouds.

**Join the CloudStack SF Bay Area Users Group**

Anyone is welcome! Come and chat over pizza and drinks.  

We will have talks from members of the foundation, committers, and users of
CloudStack discussing various aspects of its development, history,
architecture, operation and in general the direction of the project in this
and upcoming meetups. And most importantly - how to get started on
contributing yourself! Anyone is welcome to the group and we'll have beginner
sessions available as well.

",Julia,183840034.0,"['Apache CloudStack', 'networks', 'virtual machines', 'Service', 'IaaS', 'cloud computing platform', 'CloudStack', 'service providers', 'public cloud services', 'companies', 'on-premises', 'private', 'hybrid cloud solution', 'turnkey solution', 'stack', 'features', 'organizations', 'orchestration', 'Network-as-\na-Service', 'user', 'management', 'native', 'API', 'resource', 'first-class User Interface', 'UI', 'hypervisors', 'VMware', 'KVM', 'XenServer', 'Xen Cloud Platform', 'XCP', 'Users', 'cloud', 'Web interface', 'command line', 'tools', 'full-featured RESTful', 'AWS', 'EC2', 'S3', 'hybrid clouds', 'SF', 'Bay Area Users Group', 'Anyone', 'Come', 'chat', 'pizza', 'drinks', 'talks', 'members', 'foundation', 'committers', 'users', 'development', 'history', 'architecture', 'operation', 'direction', 'project', 'upcoming', 'meetups', 'importantly', 'started', 'contributing', 'group', 'beginner', 'sessions']"
11196482,CouchDB™ Boston,CouchDB-Boston,http://www.meetup.com/CouchDB-Boston/,4.66,1385055343000,"Relax, it's CouchDB! CouchDB Boston brings together developers, technologists,
and anyone else passionate or curious about CouchDB to swap stories, share
projects, code apps, and otherwise relax on the couch. All skill levels are
welcome, whether you've got hundreds of nodes replicating petabytes around the
world, or just heard about CouchDB when you found this page. Join us for good
food, good folks, and good times :D

All events organized by this meetup group fall under the [Apache CouchDB™ Code
of Conduct and Diversity Statement](https://couchdb.apache.org/conduct.html).  

_Apache CouchDB™, CouchDB™ and Apache are either registered trademarks or
trademarks of the[Apache Software Foundation](http://www.apache.org/) in the
United States and/or other countries, and are [used with
permission](https://www.apache.org/foundation/marks/events.html#attributions).
The Apache Software Foundation has no affiliation with and does not endorse,
or review the materials provided at this event, which is managed by [IBM Cloud
Data Services](http://www.cloudant.com)._  

",Raj Singh,9125434.0,"['Relax', 'CouchDB', 'CouchDB Boston', 'developers', 'technologists', 'passionate', 'stories', 'projects', 'code apps', 'couch', 'skill levels', 'nodes', 'replicating', 'petabytes', 'world', 'page', 'food', ':D', 'events', 'meetup group', 'Apache CouchDB™ Code', 'Conduct', 'Diversity', 'Statement](https://couchdb.apache.org/conduct.html', 'Apache CouchDB™', 'CouchDB™', 'Apache', 'trademarks', 'the[Apache Software Foundation](http://www.apache.org/', 'United States', 'countries', 'Apache Software Foundation', 'review', 'materials', 'event', 'IBM', 'Data', 'Services](http://www.cloudant.com']"
19380293,HPE Haven OnDemand Boston Meetup,HPE-Haven-OnDemand-Boston-Meetup,http://www.meetup.com/HPE-Haven-OnDemand-Boston-Meetup/,0.0,1453322586000,"![](http://photos1.meetupstatic.com/photos/event/c/c/c/c/600_446092428.jpeg)

This meetup group for those interested in big data, machine learning,
predictive analytics, hackathons, social coding and professional networking
sponsored by [HPE Haven OnDemand](https://www.havenondemand.com/). Everyone is
welcome from beginners to guru's of the data world. Let's get together for
technical discussions, demos, coding sessions and more while exploring fun
events and activities in Boston.

  

",Jenn,198386597.0,"['http://photos1.meetupstatic.com/photos/event/c/c/c/c/600_446092428.jpeg', 'meetup group', 'data', 'machine learning', 'predictive analytics', 'hackathons', 'social coding', 'professional networking', 'HPE', 'Everyone', 'beginners', ""guru's"", 'data world', 'technical discussions', 'demos', 'coding sessions', 'events', 'activities', 'Boston']"
10985542,Personal Clouds Boston,Personal-Clouds-Boston,http://www.meetup.com/Personal-Clouds-Boston/,0.0,1383690675000,"Personal Cloud Computing Boston

We build collaborations between individuals and organizations working in the
personal identity space.

",Adam Laughlin,7818021.0,"['Personal Cloud Computing', 'collaborations', 'individuals', 'organizations', 'personal identity space']"
20422731,Predix Builders of Boston,Predix-Builders-of-Boston,http://www.meetup.com/Predix-Builders-of-Boston/,0.0,1473798282000,"Have you had a chance to try GE’s Predix, the cloud platform for the
Industrial Internet? Join this Meetup group and share comments, questions, and
tips with each other about experiences building on the Predix platform.

Learn what other developers are doing and swap stories with them about what
works best. Also get news and ideas from tech thought-leaders who share their
vision about industrial software, analytics, big data, cloud computing, cyber
security, open source, and more.

Jump right in to group discussions, hear conference news, and discover Predix
developer activities and opportunities.

",J12Y,12555021.0,"['chance', 'GE', 'Predix', 'cloud platform', 'Industrial Internet', 'Meetup group', 'comments', 'questions', 'tips', 'experiences', 'Predix platform', 'developers', 'swap', 'stories', 'news', 'ideas', 'tech thought-leaders', 'vision', 'industrial software', 'analytics', 'data', 'cloud computing', 'cyber', 'security', 'open source', 'Jump right', 'group', 'discussions', 'conference news', 'Predix\n', 'developer', 'activities', 'opportunities']"
13070412,Boston Futurist Society,Boston-Futurist-Society,http://www.meetup.com/Boston-Futurist-Society/,5.0,1393351915000,"Driven by the motivation to predict, influence and create the future, Boston
Futurists seek to take the best this city has to offer in terms of its diverse
investment in technology, science, ecommerce and the arts. Let's gather
together and forge a new direction, and have a fun time doing it!

  

On the first weekend of the month from 1pm - 3pm, we have an event based
meetup where we demo cutting edge technology or listen to speakers who work in
future related fields.  

  

On the third Tuesday of the month from 7:30pm - 9pm, we have a discussion
about trends and topics related to future studies. This is a great time to get
to know our group and gives everyone an opportunity to think and discuss the
future.

There is a subreddit reddit.com/r/BostonFuturists to work in parallel with
this community, and a much larger subreddit dedicated to future studies -
reddit.com/r/Futurology!

",Dan Corcoran,173177262.0,"['motivation', 'influence', 'Boston', 'Futurists', 'city', 'diverse', 'investment', 'technology', 'science', 'arts', 'direction', 'weekend', 'month', 'event', 'demo cutting edge technology', 'speakers', 'fields', 'Tuesday', 'discussion', 'trends', 'topics', 'studies', 'group', 'community', 'larger']"
165993,New England Wikimedians,wikipedia-5,http://www.meetup.com/wikipedia-5/,4.65,1051483949000,"A collection of good-hearted, fast-fingered, quick-shuttered New England
Wikimedians and fans if Wikipedia and associated projects. We are always
looking for new members, so feel free to check us out if you are interested,
as we would love to meet you!

",SJ,372973.0,"['collection', 'good-hearted', 'fast-fingered', 'quick-shuttered New England', 'Wikimedians', 'fans', 'Wikipedia', 'associated projects', 'members']"
9783402,API Craft Boston,API-Craft-Boston,http://www.meetup.com/API-Craft-Boston/,4.93,1376353059000,"About the Boston Members  

API Craft Boston is a vibrant community of individual API practitioners who
see building APIs as a craft. Our goal is to drive leadership and open
discussion in the API development space as we move toward a more connected
world. Also, check out API Craft on Google Groups to collaborate with other
API craftspeople around the world.

Our standards are simple - we are a community of individual API practitioners
who see building APIs as a craft.

We represent our own opinions, and not that of employers or anyone else.

This meetup  _is open_ to thoughtful posts from prospective employers who want
great API thinkers and doers.

This meetup _is not open_ to posts from vendors who are promoting their
products or spamming recruiters.

Come collaborate in an open space to get tips, ask questions you may have
about APIs, and then feel free to hop into the conversations.

[API- Craft Conference](http://vimeo.com/72267203) from [Joe
Monzo](http://vimeo.com/user17864978) on [Vimeo](https://vimeo.com/).

",pete gamache,163903832.0,"['Boston Members', 'community', 'individual', 'API', 'practitioners', 'APIs', 'craft', 'goal', 'leadership', 'discussion', 'development space', 'world', 'Google Groups', 'craftspeople', 'standards', 'opinions', 'employers', 'meetup  ', 'posts', 'prospective employers', 'thinkers', 'doers', 'vendors', 'products', 'spamming', 'recruiters', 'Come collaborate', 'open space', 'tips', 'questions', 'hop', 'conversations', 'API- Craft', '[Vimeo](https://vimeo.com/']"
6725742,Boston Growth Hackers,Boston-Growth-Hackers,http://www.meetup.com/Boston-Growth-Hackers/,4.57,1358538640000,"Calling all **Growth Hackers!** Are you obsessed with growing your business
through carefully designed and tested internet marketing? Do you like to A/B
test everything you do in life? If so, you have come to the right place! We
plan to gather the very best Growth Hackers in Boston to exchange ideas,
brainstorm new growth hacks, and inspire each other to achieve new levels of
growth hacking success!

_[growth hacker (noun) - one who’s passion and focus is pushing a metric
through use of a testable and scalable methodology.]_

",Dave Vislosky,61954732.0,"['Calling', '**', 'tested', 'internet marketing', 'A/B\n', 'life', 'right place', 'plan', 'Growth Hackers', 'Boston', 'brainstorm', 'growth hacks', 'levels', 'growth hacking', 'growth hacker', 'noun', 'passion', 'metric', 'testable', 'methodology']"
14305392,Parallella Users in Boston,parallella-boston,http://www.meetup.com/parallella-boston/,0.0,1399406859000,"This is a group for anyone interested in the Parallella project (aka
""supercomputing for everyone""). The group will meet once a month to discuss
the latest Parallella news and talk about active open source software and
hardware efforts. Parallella users are encouraged to bring Parallellas along
and share experiences with the rest of the group. Based on initial interest,
we will dedicate part of the meetup to discussions about robotics,
uavs/drones, computer vision, machine learning, and software defined radio.  

",Andreas Olofsson,10425139.0,"['group', 'Parallella project', 'supercomputing', 'month', 'Parallella', 'talk', 'active open source software', 'hardware', 'Parallella users', 'Parallellas', 'experiences', 'meetup', 'discussions', 'robotics', 'computer vision', 'machine learning', 'software']"
331893,App Devs + Entrepreneurs,applications,http://www.meetup.com/applications/,4.6,1159201082000,"Architects, developers and entrepreneurs meet to collaborate and discuss
developing web and mobile applications with the latest technologies.

[_Companies and Recruiters: If you post an opportunity, please consider
chipping in._](https://secure.meetup.com/applications/contribute/)

SPONSOR MESSAGE  
Lyft is currently offering members of our Meetup free ride credit to try the
service! Just [click here](https://www.lyft.com/invited/ENTREPRENEURS) or
visit <https://www.lyft.com/invited/ENTREPRENEURS> to get the free credit. I
love Lyft and have had great ride experiences.

",Maureen,11316246.0,"['Architects', 'developers', 'entrepreneurs', 'collaborate', 'web', 'mobile', 'applications', 'technologies', 'Companies', 'Recruiters', 'post', 'chipping in._](https://secure.meetup.com/applications/contribute/', 'SPONSOR', 'MESSAGE', 'Lyft', 'members', 'Meetup free ride credit', 'service', 'click here](https://www.lyft.com/invited/ENTREPRENEURS', 'visit', 'https://www.lyft.com/invited/ENTREPRENEURS', 'free credit', 'ride', 'experiences']"
8812662,Big Data Meetup Boston,BigDBN,http://www.meetup.com/BigDBN/,4.51,1370540670000,"This is a group to connect Big Data enthusiasts in Boston for networking,
presentations, workshops, demonstations and much more. This group is ideal
for: * Big Data Startup Companies * Entrepreneurs * Developers and Programmers
* Investors * Big Data Recruiters * Big Data Service Providers

",ACM,176842802.0,"['group', 'Big Data enthusiasts', 'Boston', 'networking', 'presentations', 'workshops', 'demonstations', 'Programmers\n*']"
3121272,Drinks On Tap,DrinksOnTap,http://www.meetup.com/DrinksOnTap/,4.6,1326830044000,"Drinks On Tap is a social meet up for the mobile developer community. This
regular event draws the best developers and designers to share what we've been
working on over drinks. Join us!  

We are always looking for amazing demos of mobile software from companies in
the Boston Area. If you're working on something that you want to show off, we
want to see it.

Got a cool app? [Apply to demo at Drinks on Tap](http://bit.ly/DOT-Demo).

[](http://bit.ly/DrinksOnTapSF_Demo)The event is organized nationally by
[Raizlabs](http://www.raizlabs.com/)

  

  

",Greg Raiz,2032040.0,"['Drinks', 'Tap', 'social meet', 'mobile developer', 'community', 'event', 'developers', 'designers', 'working', 'drinks', 'demos', 'mobile software', 'companies', 'Boston Area', 'nationally', '[Raizlabs](http://www.raizlabs.com/']"
1460349,"Boston Cloud Services - All things Cloud,  SaaS, PaaS, XaaS",Boston-cloud-services,http://www.meetup.com/Boston-cloud-services/,4.68,1243003059000,"A group dedicated to sharing, evangelizing and promoting the next big wave in
technology, Cloud based services: software (SaaS), Platform (PaaS) as-a-
service etc with a focus on the end users of cloud services; specifically
people who have dealt or are dealing with the move from on-premise to the
cloud and either have faced or are facing issues, Business & Technical like:
security, management, integration etc. How product management or IT changes
when you're building or using a Cloud / SaaS product.

",Eric Keller,55761392.0,"['group', 'evangelizing', 'promoting', 'technology', 'Cloud based services', 'software', 'SaaS', 'Platform', 'as-a-', 'service', 'users', 'cloud services', 'people', 'cloud', 'issues', 'security', 'management', 'integration', 'product management', 'IT', 'changes', 'building', 'Cloud', 'product']"
1462401,Boston CiviCRM Meetup,Boston-CiviCRM-Meetup,http://www.meetup.com/Boston-CiviCRM-Meetup/,4.76,1243430345000,"[CiviCRM](http://civicrm.org/) is a web-based, open source, Constituent
Relationship Management (CRM) software geared toward meeting the needs of non-
profit and other civic-sector organizations.

[Boston CiviCRM meetup](http://www.meetup.com/Boston-CiviCRM-Meetup/) is the
user group aimed at bringing together Boston area CiviCRM developers,
implementers, administrators, end users, and curious newcomers to:

  * Learn more about the CRM system through peer knowledge sharing and training sessions
  * Discuss how organizations are using it to address their CRM needs
  * Demonstrate customized functionality
  * Discuss future development of the system

We share meeting notes and files here: https://seacloud.cc/d/997162748d/

",John Sullivan,3561144.0,"['[CiviCRM](http://civicrm.org/', 'web-based', 'Constituent', 'CRM', 'meeting', 'profit', 'civic-sector organizations', 'Boston CiviCRM meetup](http://www.meetup.com/Boston-CiviCRM-Meetup/', 'user group', 'Boston area', 'CiviCRM', 'developers', 'implementers', 'administrators', 'end users', 'newcomers', 'CRM system', 'peer', 'knowledge', 'training', 'sessions', 'organizations', 'Demonstrate', 'functionality', 'development', 'system', 'notes', 'files', 'https://seacloud.cc/d/997162748d/']"
