id,name,urlname,link,rating,created,description,organiserName,organiserMemberId,tags
10128932,Boston Business Intelligence,Boston-Business-Intelligence,http://www.meetup.com/Boston-Business-Intelligence/,4.71,1378429904000,"Mission of the Group is: To facilitate a training and discussion environment
for BI Developers, Architects, Administrators , IT professionals and Business
Analysts that focusing on building real-world Business Intelligence solutions
and applications using the Microsoft Business Intelligence Platform tools and
technology. To provide an opportunity for the members to share a knowledge,
practical experience and participate in advanced technological discussions
with BI Community members. We have regular face-to-face with HANDS-ON meetings
including guest speakers. We located in the GREATER BOSTON area. We meet First
Tuesday of each Month. This is FREE Group, Membership is open to all
interested in learning the latest technology and tools in Microsoft Business
Intelligence Platform: Analysis Services (SSAS), Repoting Services (SSRS),
Integration Services (SSIS), MDS and languages (MDX, DAX, DMX) as well as
Client side Data Analysis Applications such as MS SharePoint Server,
PowerPivot, PowerView, MS Office Excel, Visio. Learn best practices from
professionals engaged in architecture design and development of: Enterprise
Data Warehouses Business Intelligence Systems Business Analysis Systems
Executive Dashboards. Share a knowledge, resources, network with people who
are in MS BI space.

",Slava Kokaev,42677712.0,"['Mission', 'Group', 'training', 'discussion environment', 'BI', 'Developers', 'Architects', 'Administrators', 'IT professionals', 'Business', 'Analysts', 'applications', 'Microsoft Business Intelligence Platform tools', 'technology', 'members', 'knowledge', 'experience', 'participate', 'advanced', 'technological discussions', 'Community members', 'HANDS-ON meetings', 'guest speakers', 'GREATER', 'BOSTON area', 'Tuesday', 'Month', 'FREE', 'Membership', 'interested', 'learning', 'tools', 'Microsoft Business\nIntelligence Platform', 'SSAS', 'Repoting Services', 'SSRS', 'Integration Services', 'SSIS', 'MDS', 'languages', 'MDX', 'DAX', 'DMX', 'Client', 'side Data Analysis', 'MS SharePoint Server', 'PowerPivot', 'PowerView', 'Visio', 'practices', 'professionals', 'architecture', 'design', 'development', 'Enterprise', 'resources', 'network', 'people', 'MS']"
11834922,Boston Virtual Reality,Boston-Virtual-Reality,http://www.meetup.com/Boston-Virtual-Reality/,4.82,1388985247000,"We're here to talk about, program, share, and demonstrate software, hardware,
and ideas for the upcoming new wave of virtual reality.  Whether you're an
avatar who spends more time in virtual worlds than the real one or someone
who's never even worn a head mounted display, you'll find a great group of
people who love VR. Each month we bring in presenters from companies who are
pioneering VR technology and also feature an array of demonstrations created
by our local VR developers. They can help you embark comfortably on your first
VR experience or dive deep into VR design and discuss the latest news from the
fast changing world of VR. We are a government certified 501(c)(3) non-profit
organization which means that all ticket fees and donations are dedicated to
putting on more VR events in Boston and that all donations are tax deductible.

Join us on [Google Groups
BostonVR](https://groups.google.com/forum/#%21forum/bostonvr)

On Twitter [@BostonVRMeetup](https://twitter.com/bostonvrmeetup)  

Also at our [LinkedIn group](https://www.linkedin.com/groups/Boston-Virtual-
Reality-6659330?home=&gid=6659330)

And on [YouTube ](https://www.youtube.com/channel/UCLkfhiM3LC1iLB9fOcTS3Og)  

",Jeffrey Jacobson,38992002.0,"['talk', 'program', 'software', 'hardware', 'wave', 'virtual reality', 'avatar', 'virtual worlds', 'worn', 'head mounted display', 'group', 'people', 'love VR', 'month', 'presenters', 'companies', 'VR', 'technology', 'array', 'demonstrations', 'local', 'developers', 'experience', 'dive', 'deep', 'design', 'news', 'changing', 'government', 'non-profit', 'organization', 'ticket fees', 'donations', 'events', 'Boston', 'deductible', 'Google Groups', 'Twitter', 'LinkedIn group](https://www.linkedin.com/groups/Boston-Virtual-\nReality-6659330?home=&gid=6659330', 'https://www.youtube.com/channel/UCLkfhiM3LC1iLB9fOcTS3Og']"
20375090,Greater Boston Chinese Software Engineers,Greater-Boston-Chinese-Software-Engineers,http://www.meetup.com/Greater-Boston-Chinese-Software-Engineers/,0.0,1472678825000,"为软件开发者提供互相交流学习的场所, 此小组专注于软件开发的技术探讨和Idea交流,

欢迎身在波士顿或者美东地区，甚至北美的Developer们加入!

Aim to provide a place for those Chinese-speaking software developers to talk
and learn from each other

",Marko Cen,191236949.0,"['为软件开发者提供互相交流学习的场所', '此小组专注于软件开发的技术探讨和Idea交流', 'Chinese-speaking software developers']"
1728053,App Development Meetup - Greater Boston,App-Development-Meetup,http://www.meetup.com/App-Development-Meetup/,4.85,1288041711000,"This group is for those interested in apps and app development for iOS and
Android.

",Farzad ,11586796.0,"['group', 'apps', 'app development', 'iOS', 'Android']"
19426879,Boston Elm Lang Meetup,Boston-Elm-Lang-Meetup,http://www.meetup.com/Boston-Elm-Lang-Meetup/,0.0,1453661977000,"Elm is a functional reactive programming language and architecture for
declaratively building web browser based graphical user interfaces and
applications. This meetup is for software developers of all skill levels who
are interested in learning more about how Elm can help build highly performant
and maintainable web application UIs in very little time and with fewer bugs.

",Dan Fields,162566432.0,"['Elm', 'functional', 'reactive programming language', 'architecture', 'declaratively', 'web browser', 'graphical user interfaces', 'applications', 'meetup', 'software developers', 'skill', 'learning', 'performant', 'maintainable', 'web application', 'UIs', 'bugs']"
19054860,Greater Boston QA and Testing Meetup,Boston-QA-Meetup,http://www.meetup.com/Boston-QA-Meetup/,4.67,1445630739000,"Calling all quality assurance and test engineering professionals! This is a
group for anyone interested in discussing the latest issues in software
development for quality assurance professionals. Let's share knowledge and
best practices and elevate our craft across the industry! Whether interested
in QA automation, engineering, testing, or simply wanting to learn more about
the tech industry - all are welcome!

Join our Slack chat at [https://testing-slack-auto-
invite.herokuapp...](https://testing-slack-auto-invite.herokuapp.com/)!

",Conrad Hollomon,194532776.0,"['Calling', 'quality assurance', 'test engineering professionals', 'group', 'issues', 'software', 'development', 'quality assurance professionals', 'knowledge', 'practices', 'elevate', 'craft', 'industry', 'QA', 'automation', 'engineering', 'testing', 'tech industry', 'Slack chat']"
1715787,Boston Android,boston-android,http://www.meetup.com/boston-android/,4.59,1285969377000,"We are designers, developers, employers, and general enthusiasts around
building the Android mobile platform. We gather to share ideas, help each
other, and generally get things done.

",Jinn Kim,3242911.0,"['designers', 'developers', 'employers', 'enthusiasts', 'Android mobile platform']"
1846861,Libre Boston: GNU/Linux Free Software Users Group,desktop-linux-users-group,http://www.meetup.com/desktop-linux-users-group/,4.68,1305172470000,"Whether you're running GNU/Linux as your desktop operating system or
interested in doing so, this Meetup is for you. Our goal is to create an
environment that's welcoming, fun, and educational.

A paradox...

The argument for open source (""free"" as in speech) software is stronger than
ever.

GNU/Linux has been wildly successful in the server market.

Desktop GNU/Linux operating systems like Ubuntu provide a rich end-user
experience on par or better than commercial rivals in many respects.

...Yet the uptake of using GNU/Linux as an end-user (desktop/laptop) operating
system still lags. This Meetup aims to end that by:

1\. Creating a community of GNU/Linux on the desktop enthusiasts.

2\. Providing a venue where GNU/Linux questions can get asked by users of all
levels.

3\. Fostering GNU/Linux on the desktop evangelism. Let's spread the word!

We welcome long time GNU/Linux enthusiasts, those who've heard of GNU/Linux
but aren't even sure what it is, and everyone in between. Join us!

**We're part of BLU!** BLU is the **Boston Linux & Unix User Group** and has
been meeting actively since 1994.  BLU does a fantastic job of covering topics
across the broad spectrum of GNU/Linux, from technical topics to end-user
topics.  I'm excited that BLU has invited our group to become a sub\- group of
theirs.  This gives us tremendous support from more experienced users and
allows us to coordinate events.  As a sub\- group, we aim to focus on using
GNU/Linux on the desktop and attracting new and less technical users to the
platform.  To learn more about BLU, please visit [http://www.
blu.org](http://www.blu.org/).

To learn more about our group, please visit <http://LibreBoston.org>.  

",Will Rico,11531220.0,"['running', 'GNU/Linux', 'desktop operating system', 'Meetup', 'goal', 'environment', 'welcoming', 'fun', 'educational', 'paradox', 'argument', 'open source', 'speech', 'server market', 'Desktop GNU/Linux operating systems', 'Ubuntu', 'end-user', 'experience', 'commercial', 'uptake', 'system', 'community', 'desktop enthusiasts', 'venue', 'GNU/Linux questions', 'users', 'levels', 'Fostering', 'desktop evangelism', 'word', 'long time', 'enthusiasts', 'everyone', 'BLU', '**', 'fantastic job', 'topics', 'spectrum', 'technical topics', 'excited', 'group', 'sub\\- group', 'coordinate events', 'desktop', 'technical users', 'please visit']"
5809742,Boston Realtime Data,RealTimeData,http://www.meetup.com/RealTimeData/,4.59,1352732031000,"Boston Realtime DAta is a group for developers using or hoping to learn about
streaming technologies and data processing frameworks, such as Kafka, Storm,
Samza, Spark Streaming, and the NoSQL stores used to support these
infrastructures. We get together to discuss best practices, to exchange ideas
and to learn how to apply these frameworks to various engineering challenges.

",mg,151961342.0,"['Boston Realtime', 'DAta', 'group', 'developers', 'streaming technologies', 'data processing frameworks', 'Kafka', 'Storm', 'Samza', 'Spark Streaming', 'NoSQL', 'stores', 'infrastructures', 'practices', 'exchange', 'frameworks', 'engineering']"
20194895,Boston-Cambridge Financial Technology Meetup,Boston-Cambridge-Finance-Technology-Meetup,http://www.meetup.com/Boston-Cambridge-Finance-Technology-Meetup/,0.0,1468792709000,"Calling all Fintrepreneurs, Fintech innovators, Fintechnologists, and
Finthusiasts. Especially if you're on the MIT Fintech course, this would be a
great place to connect.

",Venkat,39440782.0,"['Calling', 'Fintrepreneurs', 'Fintech innovators', 'Fintechnologists', 'Finthusiasts', 'MIT', 'Fintech course']"
1289145,Django Boston Meetup Group,djangoboston,http://www.meetup.com/djangoboston/,4.72,1222316770000,"Django is a high-level Python Web framework that encourages rapid development
and clean, pragmatic design. Read more about it at <http://djangoproject.com>

  

* Twitter: [@djangoboston](https://twitter.com/djangoboston)  

",Nate Aune,58579.0,"['Django', 'high-level', 'Python Web framework', 'rapid', 'development', 'clean', 'pragmatic design', 'http://djangoproject.com>\n\n  \n\n*', '[@djangoboston](https://twitter.com/djangoboston']"
20201058,Open Source Tools for Testing in DevOps Era - Boston Meetup,Open-Source-Tools-for-Testing-in-DevOps-Era-Boston-Meetup,http://www.meetup.com/Open-Source-Tools-for-Testing-in-DevOps-Era-Boston-Meetup/,4.5,1468930599000,"Learn from and meet with other developers, DevOps, performance engineers and
QA professionals using open source tools to test web and mobile appsin the era
of continuous integration, delivery and DevOps. This is an open forum where
you can interact, network and share insights and information.

Topics include JMeter, Selenium, Jenkins, Gatling, Locust, test automation,
scripting, performance, load and stress testing, test-driven development,
continuous integration, continuous testing, and continuous integration and
delivery. Feel free to request and post other related discussion topics. We
try to get together regularly and would love to meet you at the next event.
Sponsored by BlazeMeter, we often share upcoming webinars and events related
to JMeter, performance and load testing given by BlazeMeter.

",Jason Silberman,67732972.0,"['Learn', 'developers', 'DevOps', 'performance engineers', 'QA', 'professionals', 'open source tools', 'test', 'web', 'mobile', 'era', 'continuous integration', 'delivery', 'interact', 'network', 'information', 'Topics', 'JMeter', 'Selenium', 'Jenkins', 'Gatling', 'Locust', 'test automation', 'scripting', 'performance', 'load', 'stress testing', 'test-driven development', 'continuous testing', 'post', 'discussion topics', 'event', 'Sponsored', 'BlazeMeter', 'webinars', 'events', 'load testing']"
17382302,Boston Data Engineering Meetup,Boston-Data-Engineering-Meetup,http://www.meetup.com/Boston-Data-Engineering-Meetup/,4.8,1412367227000,"We're a group of engineers who work with data and data processing systems. We
are especially interested in the aspects of those systems that *aren't* ""Data
Science""--those difficult and crucial activities like: \- getting,
reformatting and cleaning up the data \- designing data processing systems for
easy forensics \- operating valuable data processing systems in the real world
If you read that New York Times article ""For Big-Data Scientists, 'Janitor
Work' Is Key Hurdle to Insights"" and thought ""Data Janitor and Proud!"" then
you should join us.

",Jake Ouellette,76804812.0,"['group', 'engineers', 'data', 'data processing systems', 'systems', 'activities', '\\-', 'reformatting', 'cleaning', 'data processing', 'forensics', 'operating', 'real world', 'New York Times article', 'Big-Data Scientists', 'Janitor', 'Data']"
8201832,Cloud Centric Boston,Cloud-Centric-Boston,http://www.meetup.com/Cloud-Centric-Boston/,4.88,1366811285000,"Cloud Centric Boston exists to encourage the exchange of knowledge amongst IT
and Business Professionals around all aspects of the Virtualization, Cloud
Computing and Data Center solutions orchestrated through monthly meetings,
evaluating industry trends and vendor solutions.

",Mike Hall,14916881.0,"['Cloud Centric Boston', 'exchange', 'knowledge', 'IT', 'Business Professionals', 'Virtualization', 'Cloud\nComputing', 'Data Center', 'monthly', 'meetings', 'evaluating', 'industry', 'vendor solutions']"
16242282,"Cloud, Web & Mobile AppDev Tech Talks",Cloud-Web-Mobile-App-Development-Tech-Talks,http://www.meetup.com/Cloud-Web-Mobile-App-Development-Tech-Talks/,0.0,1407413957000,"This is a group for people interested in learning more about Cloud technology
and how they can apply it to Web &amp; Mobile Application development. A key
focus of our meetups is providing time for members to ask questions and help
each other solve problems. I started this group because I felt like it could
help connect people who otherwise would only be in more language or
technology-specific groups.

",Sunny Gleason,159042962.0,"['group', 'people', 'learning', 'Cloud technology', 'Web &amp', 'Mobile Application development', 'meetups', 'members', 'questions', 'problems', 'I', 'language', 'technology-specific groups']"
19230315,Metrowest Golang Meetup,Metrowest-Golang-Meetup,http://www.meetup.com/Metrowest-Golang-Meetup/,5.0,1450726626000,"A group for people that hack on Golang for fun or profit. The plan is for a
monthly meetup that may consist of talks, projects that people want to share,
or any other format that the community would like. Preference will be given to
Open Source tools and solutions to common problems. Golang skills are not
required to join, come and talk with us and learn.

",Matty Jones,99097522.0,"['group', 'people', 'hack', 'Golang', 'profit', 'plan', 'monthly', 'talks', 'projects', 'format', 'community', 'Preference', 'Open Source tools', 'solutions', 'problems', 'Golang skills', 'learn']"
11421302,General Assembly Boston - Tech Talks,GA-Boston-TechTalks,http://www.meetup.com/GA-Boston-TechTalks/,4.5,1386772238000,"Free talks on topics related to mobile and web development, UX design, data
analytics, and product management.

  

",Matt Brendzel,62598742.0,"['Free talks', 'topics', 'mobile', 'web development', 'UX design', 'data', 'analytics', 'product management']"
9633402,PyData Boston,PyData-Boston,http://www.meetup.com/PyData-Boston/,4.67,1375455986000,"Intersection of Python and Data Science

",John Verostek,2220559.0,"['Intersection', 'Python']"
5238402,Learning Analytics Boston,Learning-Analytics-Boston,http://www.meetup.com/Learning-Analytics-Boston/,4.64,1349359014000,"This group will provide a place to meet and discuss potential use of existing
technologies and practice in the service of improving education. I started
this group because there is a rich community across disciplines that offer a
wide variety of complex approaches to this topic that merit review in the
context of the the education sector. I look forward to reviewing technologies,
organizing some hands on labs, participating in dialogue, and pursuing
innovative approaches with you.

",Garron Hillaire,31812932.0,"['group', 'potential', 'technologies', 'practice', 'service', 'improving', 'education', 'I', 'community', 'disciplines', 'complex', 'approaches', 'review', 'context', 'education sector', 'reviewing technologies', 'hands', 'labs', 'dialogue', 'innovative approaches']"
13649542,SaaS Boston,SaaS-Boston,http://www.meetup.com/SaaS-Boston/,4.87,1396279917000,"SaaS is a rapidly-growing market, and an extremely popular and economic way of
deploying software. We'd like to promote networking, discussions and
collaboration between service providers, entrepreneurs, developers, executives
and potential customers in the Boston area. Come join us to learn more about
SaaS!

","Zorian (aka ""Z"")",11739484.0,"['SaaS', 'rapidly-growing market', 'economic way', 'deploying software', 'promote', 'networking', 'discussions', 'collaboration', 'service providers', 'entrepreneurs', 'developers', 'executives', 'potential', 'customers', 'Boston area']"
19781258,Boston Google Cloud Meetup,Boston-Google-Cloud-Meetup,http://www.meetup.com/Boston-Google-Cloud-Meetup/,5.0,1459429992000,"Let's get together to share perspectives and learn about building and running
applications on Google Cloud Platform. We can talk about lessons that we've
learned using the platform, share best practices, compare/contrast experiences
with other platforms, and ask Google and its partners to give us the scoop on
new releases and announcements.

",Dan Belcher,25485332.0,"['perspectives', 'learn', 'building', 'running', 'applications', 'Google Cloud Platform', 'lessons', 'learned', 'platform', 'practices', 'compare/contrast experiences', 'platforms', 'Google', 'partners', 'scoop', 'releases', 'announcements']"
18142862,Town Tech,Town-Tech,http://www.meetup.com/Town-Tech/,0.0,1415393654000,"Charlestown tech group! If you live in Charlestown and are a technology
professional or want to become one, this is the place to be. We'll meet
somewhere in C'town, so always walking distance from anywhere. Discussion
topics totally open, but the majority will probably be around the local Boston
scene, what various companies are up to, and software engineering topics.
Networking encouraged of course.

",Chris Collier,50459582.0,"['Charlestown tech group', 'live', 'Charlestown', 'technology', 'professional', ""C'town"", 'walking', 'distance', 'topics', 'local Boston\n', 'scene', 'companies', 'software engineering', 'Networking', 'course']"
18470549,Boston Gay Software Developers,Boston-Gay-Software-Developers,http://www.meetup.com/Boston-Gay-Software-Developers/,4.5,1425264058000,"This is a group for all LGBT tech workers in the Boston area: devs, designers,
IT, operations, you name it. We meet to swap stories, network, discuss issues,
and share tech experience. All languages and orientations welcome!

",Steven,184872741.0,"['group', 'LGBT', 'tech workers', 'Boston area', 'devs', 'designers', 'IT', 'operations', 'swap stories', 'network', 'issues', 'tech experience', 'languages', 'orientations']"
19652249,Boston Social Entrepreneurship Meetup,Boston-Social-Entrepreneurship-Meetup,http://www.meetup.com/Boston-Social-Entrepreneurship-Meetup/,0.0,1456928915000,"If you are a socially conscious entrepreneur and would like to connect with
like minded clients, peers, partners... come join our creative group! We work
to promote, partner and provide an open portal for information sharing with
likeminded entrepreneurs, technical professionals and innovators who are
actively contributing to technological progress and enthusiastic about finding
ways to solve social, medical, cultural or environmental problems. Working
together we can accomplish more!

",Viktoria,55968242.0,"['socially conscious', 'clients', 'peers', 'partners', 'creative group', 'promote', 'open portal', 'information', 'likeminded entrepreneurs', 'technical professionals', 'innovators', 'technological progress', 'enthusiastic', 'finding', 'social', 'medical', 'cultural', 'environmental problems', 'Working']"
2965152,New England Artificial Intelligence,intelligence,http://www.meetup.com/intelligence/,4.6,1324231591000,"Welcome!

Our group is for those interested in AI, machine learning, forecasting,
recommendation systems, and building smarter applications. We share experience
and knowledge in the field, and help each other with ideas and projects.

This is a group for sharing and learning about AI -- also eating and drinking.

The community of AI programmers in New England is an important part of the
vibrant software industry in the region, and contributes to the global trend
toward improving products and infrastructure.

",Dan Von Kohorn,200542.0,"['Welcome', 'group', 'AI', 'machine learning', 'forecasting', 'recommendation systems', 'applications', 'experience', 'knowledge', 'field', 'ideas', 'projects', 'sharing', 'learning', 'eating', 'drinking', 'community', 'programmers', 'New England', 'software industry', 'region', 'global trend', 'improving', 'products', 'infrastructure']"
14837412,Boston Swift,Boston-Swift,http://www.meetup.com/Boston-Swift/,4.95,1401743118000,"Discussions with developers excited about Apple's new Swift language. Follow
@swiftboston on twitter!

",Dan McClain,11799149.0,"['Discussions', 'developers', 'excited', ""Apple's"", 'Swift language', '@swiftboston', 'twitter']"
11910822,Boston Startup Founder 101,Boston-Startup-Founder-101,http://www.meetup.com/Boston-Startup-Founder-101/,4.55,1389140005000,"Successful startup ecosystems begin with a collaborative culture.

Boston Startup Founder 101 brings together aspiring and experienced tech
entrepreneurs to discuss, meet, and collaborate to build great new startups in
Boston, and to push the local startup ecosystem forward.

In this group you can learn the best practices of starting a company from
people who have been there and done that. In addition, you can meet local
founders, exchange ideas, get feedback, engage in startup workshops, meet
business partners, and more.

Join the group to be invited to our next event!

",Jonathan Greechan,11314237.0,"['startup', 'ecosystems', 'collaborative culture', 'Boston Startup Founder 101', 'tech', 'entrepreneurs', 'collaborate', 'startups', 'Boston', 'local', 'group', 'practices', 'company', 'people', 'founders', 'exchange ideas', 'feedback', 'startup workshops', 'business partners', 'invited', 'event']"
18826186,Boston Tech Interview Meetup,Boston-Tech-Interview-Meetup,http://www.meetup.com/Boston-Tech-Interview-Meetup/,4.88,1439387022000,"This meetup is for budding software engineers who would like to practice
technical interviewing, polish up their algorithms knowledge and network with
other software engineers looking to move forward in their careers. We (the
creators) are former or current Google employees interested in meeting
potential new co-workers and making a connection with the local software
development community.

",Saurya Velagapudi,59579512.0,"['meetup', 'budding software', 'engineers', 'practice', 'technical interviewing', 'polish', 'algorithms', 'network', 'software engineers', 'careers', 'creators', 'former', 'Google employees', 'meeting', 'potential', 'co-workers', 'connection', 'local software', 'development', 'community']"
